{
 "round": 1,
 "phase": "grid",
 "started": "2026-09-08T01:22:00Z",
 "finished": "2026-09-08T01:22:25Z",
 "trials": 5,
 "variants": [
  {
   "vhash": "da39a3ee5e6b4b0d3255bfef95601890afd80709",
   "variant": "base",
   "verdict": "base",
   "why": "the phone's own settings replayed; its distance to the phone's decisions is the floor",
   "params": {},
   "days": 1,
   "feasible": true,
   "effect": {
    "delta_U": 1.374,
    "rise_vs_phone_U": 1.38,
    "rest_vs_phone_U": -0.006,
    "changed_loops": 26.0
   },
   "flags": [
    "lowside_no_pred",
    "prehypo_manual_unknown",
    "tdd_from_window",
    "zero_temp_rate_proxy",
    "tt_smb_off_unknown"
   ],
   "tie_with": []
  },
  {
   "vhash": "bd3c184c0eb117ac77f3dc39a545561816c609d3",
   "variant": "autoISF_max_1.3__dura_ISF_weight_0.5",
   "verdict": "tie",
   "why": "indistinguishable from base within the noise floor on every day",
   "params": {
    "profile autoISF_max": 1.3,
    "profile dura_ISF_weight": 0.5
   },
   "rank": 1,
   "days": 1,
   "feasible": true,
   "effect": {
    "rise_vs_base_U": -0.358,
    "rest_vs_base_U": -0.049,
    "delta_vs_base_U": -0.407,
    "changed_vs_base": 12.0
   },
   "flags": [
    "lowside_no_pred",
    "prehypo_manual_unknown",
    "tdd_from_window",
    "tt_smb_off_unknown",
    "zero_temp_rate_proxy"
   ],
   "tie_with": [
    "da39a3ee5e6b4b0d3255bfef95601890afd80709",
    "ad0662e5a1c0881c7291f91080c87504dcd4921b",
    "b85a419e9024dd3e7cf04594fee7443b67ade228",
    "e1336f715a3d4c66aa228bb3876a85171a28ff50"
   ]
  },
  {
   "vhash": "b85a419e9024dd3e7cf04594fee7443b67ade228",
   "variant": "autoISF_max_1.5__dura_ISF_weight_0.5",
   "verdict": "tie",
   "why": "indistinguishable from base within the noise floor on every day",
   "params": {
    "profile autoISF_max": 1.5,
    "profile dura_ISF_weight": 0.5
   },
   "rank": 2,
   "days": 1,
   "feasible": true,
   "effect": {
    "rise_vs_base_U": -0.356,
    "rest_vs_base_U": -0.045,
    "delta_vs_base_U": -0.401,
    "changed_vs_base": 12.0
   },
   "flags": [
    "lowside_no_pred",
    "prehypo_manual_unknown",
    "tdd_from_window",
    "tt_smb_off_unknown",
    "zero_temp_rate_proxy"
   ],
   "tie_with": [
    "da39a3ee5e6b4b0d3255bfef95601890afd80709",
    "bd3c184c0eb117ac77f3dc39a545561816c609d3",
    "ad0662e5a1c0881c7291f91080c87504dcd4921b",
    "e1336f715a3d4c66aa228bb3876a85171a28ff50"
   ]
  },
  {
   "vhash": "e1336f715a3d4c66aa228bb3876a85171a28ff50",
   "variant": "autoISF_max_1.5__dura_ISF_weight_0.7",
   "verdict": "tie",
   "why": "indistinguishable from base within the noise floor on every day",
   "params": {
    "profile autoISF_max": 1.5,
    "profile dura_ISF_weight": 0.7
   },
   "rank": 3,
   "days": 1,
   "feasible": true,
   "effect": {
    "rise_vs_base_U": 0.002,
    "rest_vs_base_U": 0.004,
    "delta_vs_base_U": 0.005,
    "changed_vs_base": 0.0
   },
   "flags": [
    "lowside_no_pred",
    "prehypo_manual_unknown",
    "tdd_from_window",
    "tt_smb_off_unknown",
    "zero_temp_rate_proxy"
   ],
   "tie_with": [
    "da39a3ee5e6b4b0d3255bfef95601890afd80709",
    "bd3c184c0eb117ac77f3dc39a545561816c609d3",
    "ad0662e5a1c0881c7291f91080c87504dcd4921b",
    "b85a419e9024dd3e7cf04594fee7443b67ade228"
   ]
  },
  {
   "vhash": "ad0662e5a1c0881c7291f91080c87504dcd4921b",
   "variant": "autoISF_max_1.3__dura_ISF_weight_0.7",
   "verdict": "tie",
   "why": "indistinguishable from base within the noise floor on every day",
   "params": {
    "profile autoISF_max": 1.3,
    "profile dura_ISF_weight": 0.7
   },
   "rank": 4,
   "days": 1,
   "feasible": true,
   "effect": {
    "rise_vs_base_U": 0.0,
    "rest_vs_base_U": 0.0,
    "delta_vs_base_U": 0.0,
    "changed_vs_base": 0.0
   },
   "flags": [
    "lowside_no_pred",
    "prehypo_manual_unknown",
    "tdd_from_window",
    "tt_smb_off_unknown",
    "zero_temp_rate_proxy"
   ],
   "tie_with": [
    "da39a3ee5e6b4b0d3255bfef95601890afd80709",
    "bd3c184c0eb117ac77f3dc39a545561816c609d3",
    "b85a419e9024dd3e7cf04594fee7443b67ade228",
    "e1336f715a3d4c66aa228bb3876a85171a28ff50"
   ]
  }
 ],
 "dead_parameters": [
  {
   "key": "profile autoISF_max",
   "why": "every tried value (1.5) is indistinguishable from base within the noise floor on 2026-09-06: not testable on these days",
   "floor_ratio": 0.902
  },
  {
   "key": "profile dura_ISF_weight",
   "why": "every tried value (0.5) is indistinguishable from base within the noise floor on 2026-09-06: not testable on these days",
   "floor_ratio": 0.974
  }
 ],
 "floors": {
  "2026-09-06": {
   "floor_smb_U": 1.4500000000000002,
   "floor_tbr_U": 0.07575722220010223,
   "floor_total_U": 1.374242777799898,
   "floor_rise_U": 1.3800186111271349,
   "floor_rest_U": 0.005775833327240409,
   "floor_P_U": 0.0,
   "floor_loops": 26.0,
   "agreement_pct": 92.3529411764706,
   "loops": 340.0
  }
 },
 "front": [
  "bd3c184c0eb117ac77f3dc39a545561816c609d3",
  "b85a419e9024dd3e7cf04594fee7443b67ade228",
  "e1336f715a3d4c66aa228bb3876a85171a28ff50",
  "ad0662e5a1c0881c7291f91080c87504dcd4921b"
 ],
 "notes": [
  "Review order, not a ranking by outcome.",
  "Question \"explore\": nothing is ranked. Variants are listed by |effect| / floor, descending, where the effect is the insulin asked for vs base (rise or rest, whichever is larger against its floor).",
  "Feasible = no more insulin than base plus the floor in the two hours before a recorded low on every day (lows within 4 h after a manual bolus are not counted), inside the envelope on every day (at most 1.0 U vs base in any 3 h window and 15.0 % of the phone's TDD per day), no emulated SMB above the phone's maxBolus, factor on a cap in fewer than 50.0 % of loops, loop count equal to base. Infeasible variants are shown greyed with the reason, never ranked.",
  "Floor per day and component = |base - phone|; a difference smaller than 2 x floor is a tie (grey). Variants inside the floor on every component are indistinguishable from base within the noise floor; parameters with every point inside the floor on all days are not testable on these days.",
  "Recommended for review only if feasible on all days, top-3 on at least 80 % of the leave-one-day-out folds, the same sign of the primary effect on at least 80 % of days, and within the top 5 on the hold-out days. Settings are for you and your care team to review; nothing here changes the phone.",
  "Floors - 2026-09-06: rise 1.38 U, rest 0.01 U, total 1.37 U, 26 loops changed by the replay, base agreement 92.4 %."
 ]
}
